{
  "schema_id": "runecode.protocol.v0.ArtifactReference",
  "schema_version": "0.3.0",
  "digest": {
    "hash_alg": "sha256",
    "hash": "aaaaaaaaaaaaaaaaaaaaaaaaaaaaaaaaaaaaaaaaaaaaaaaaaaaaaaaaaaaaaaa9"
  },
  "size_bytes": 64,
  "content_type": "application/json",
  "data_class": "web_query",
  "provenance_receipt_hash": {
    "hash_alg": "sha256",
    "hash": "bbbbbbbbbbbbbbbbbbbbbbbbbbbbbbbbbbbbbbbbbbbbbbbbbbbbbbbbbbbbbbba"
  }
}
