{
  "schema_id": "runecode.protocol.v0.ArtifactReference",
  "schema_version": "0.3.0",
  "digest": {
    "hash_alg": "sha256",
    "hash": "aaaaaaaaaaaaaaaaaaaaaaaaaaaaaaaaaaaaaaaaaaaaaaaaaaaaaaaaaaaaaaa1"
  },
  "size_bytes": 128,
  "content_type": "application/json",
  "data_class": "spec_text",
  "provenance_receipt_hash": {
    "hash_alg": "sha256",
    "hash": "bbbbbbbbbbbbbbbbbbbbbbbbbbbbbbbbbbbbbbbbbbbbbbbbbbbbbbbbbbbbbbb2"
  }
}
